{
  "version": "1.0",
  "user_confirmed": true,
  "job_title": "大数据工程师",
  "requirements": [
    {
      "id": "J1",
      "type": "hard",
      "text": "本科及以上学历，计算机相关专业",
      "source_span": {
        "doc": "job",
        "quote": "本科及以上学历，计算机相关专业；",
        "start": 61,
        "end": 77
      }
    },
    {
      "id": "J2",
      "type": "hard",
      "text": "熟练 SQL 和 Scala/Python/Java",
      "source_span": {
        "doc": "job",
        "quote": "熟练使用 SQL 和至少一门大数据语言（Scala/Python/Java）；",
        "start": 81,
        "end": 120
      }
    },
    {
      "id": "J3",
      "type": "hard",
      "text": "熟悉 Hadoop 生态，有 Hive/Spark 经验",
      "source_span": {
        "doc": "job",
        "quote": "熟悉 Hadoop 生态，有 Hive/Spark 实际经验；",
        "start": 124,
        "end": 155
      }
    },
    {
      "id": "J4",
      "type": "hard",
      "text": "了解 Flink 或 Kafka Streams 流处理",
      "source_span": {
        "doc": "job",
        "quote": "了解 Flink 或 Kafka Streams 流处理框架；",
        "start": 159,
        "end": 190
      }
    },
    {
      "id": "J5",
      "type": "hard",
      "text": "有数仓建模经验，了解分层设计",
      "source_span": {
        "doc": "job",
        "quote": "有数仓建模经验，了解分层设计；",
        "start": 194,
        "end": 209
      }
    },
    {
      "id": "R1",
      "type": "responsibility",
      "text": "开发和维护 ETL 数据管道",
      "source_span": {
        "doc": "job",
        "quote": "开发和维护 ETL 数据管道；",
        "start": 235,
        "end": 250
      }
    },
    {
      "id": "R2",
      "type": "responsibility",
      "text": "设计和优化数仓分层模型",
      "source_span": {
        "doc": "job",
        "quote": "设计和优化数仓分层模型；",
        "start": 254,
        "end": 266
      }
    },
    {
      "id": "R3",
      "type": "responsibility",
      "text": "实时数据处理管道开发",
      "source_span": {
        "doc": "job",
        "quote": "负责实时数据处理管道开发；",
        "start": 270,
        "end": 283
      }
    },
    {
      "id": "P1",
      "type": "preferred",
      "text": "有 ClickHouse 或 HBase 使用经验",
      "source_span": {
        "doc": "job",
        "quote": "有 ClickHouse 或 HBase 使用经验者优先；",
        "start": 308,
        "end": 337
      }
    },
    {
      "id": "P2",
      "type": "preferred",
      "text": "有 PB 级数据处理经验",
      "source_span": {
        "doc": "job",
        "quote": "有 PB 级数据处理经验者优先。",
        "start": 341,
        "end": 357
      }
    },
    {
      "id": "T1",
      "type": "terminology",
      "text": "Hadoop/Hive/Spark",
      "source_span": {
        "doc": "job",
        "quote": "Hadoop、Hive、Spark、Flink、Kafka、ClickHouse、HBase、Airflow、Docker",
        "start": 365,
        "end": 426
      }
    }
  ],
  "prompt_injection_flags": []
}
